{
  "$schema": "https://json-schema.org/draft/2020-12/schema",
  "$id": "https://github.com/cris-wendler/zeroturn/schemas/normalized-event.schema.json",
  "title": "ZeroTurn normalized event",
  "description": "What an adapter sends to zeroturn event --harness normalized on standard input. One event per invocation. Anything not listed here is refused, which keeps private content out of ZeroTurn.",
  "type": "object",
  "required": [
    "contract",
    "harness",
    "type",
    "sessionId"
  ],
  "additionalProperties": false,
  "properties": {
    "contract": {
      "const": "zeroturn.event/1",
      "description": "The contract this event follows. A different value is refused."
    },
    "harness": {
      "type": "string",
      "minLength": 1,
      "description": "Short name of the coding harness, for example claude."
    },
    "harnessVersion": {
      "type": "string"
    },
    "type": {
      "enum": [
        "status",
        "subagent.pre",
        "file.read",
        "command.ran",
        "subagent.start",
        "subagent.stop",
        "session.stop",
        "session.end"
      ]
    },
    "sessionId": {
      "type": "string",
      "description": "Identifier of the session the harness reports."
    },
    "cwd": {
      "type": "string",
      "description": "Working directory of the session, used to find the repository and its configuration."
    },
    "model": {
      "type": "string",
      "description": "Model label as the harness shows it."
    },
    "contextPercent": {
      "type": [
        "number",
        "null"
      ],
      "minimum": 0,
      "maximum": 100
    },
    "contextWindowSize": {
      "type": [
        "integer",
        "null"
      ],
      "minimum": 0
    },
    "fiveHourPercent": {
      "type": [
        "number",
        "null"
      ],
      "minimum": 0,
      "maximum": 100
    },
    "fiveHourResetsAt": {
      "type": [
        "integer",
        "null"
      ],
      "description": "When the five hour window resets, as seconds since the epoch. Send it whenever the harness reports one: with it ZeroTurn can tell a window filling faster than the clock from one that will reset in time, and without it only the level is known."
    },
    "sevenDayPercent": {
      "type": [
        "number",
        "null"
      ],
      "minimum": 0,
      "maximum": 100
    },
    "sevenDayResetsAt": {
      "type": [
        "integer",
        "null"
      ],
      "description": "When the seven day window resets, as seconds since the epoch."
    },
    "durationMs": {
      "type": [
        "integer",
        "null"
      ],
      "minimum": 0
    },
    "agentId": {
      "type": "string",
      "description": "Identifier of the subagent, on subagent.start and subagent.stop."
    },
    "agentType": {
      "type": "string"
    },
    "backgroundTasks": {
      "type": [
        "integer",
        "null"
      ],
      "minimum": 0,
      "description": "How many background tasks are running. The count only, never their descriptions."
    },
    "endReason": {
      "type": "string"
    },
    "filePath": {
      "type": "string",
      "description": "On file.read, the file a read tool is about to open."
    },
    "ranged": {
      "type": "boolean",
      "description": "On file.read, true when the read names a starting line or a line count rather than the whole file."
    },
    "command": {
      "type": "string",
      "description": "On command.ran, the command that ran and succeeded. It is compared with the validation steps the repository configures and is not stored: what reaches a record is the name of the step it matched, or nothing."
    }
  }
}
